full_name,stars,language,description,html_url,created_at,updated_at
"codecrafters-io/build-your-own-x",528319,"Markdown","Master programming by recreating your favorite technologies from scratch.","https://github.com/codecrafters-io/build-your-own-x","2018-05-09T12:03:18Z","2026-07-19T02:25:26Z"
"freeCodeCamp/freeCodeCamp",452039,"TypeScript","freeCodeCamp.org's open-source codebase and curriculum. Learn math, programming, and computer science for free.","https://github.com/freeCodeCamp/freeCodeCamp","2014-12-24T17:49:19Z","2026-07-19T02:27:05Z"
"public-apis/public-apis",451225,"Python","A collective list of free APIs","https://github.com/public-apis/public-apis","2016-03-20T23:49:42Z","2026-07-19T02:15:12Z"
"EbookFoundation/free-programming-books",392432,"Python",":books: Freely available programming books","https://github.com/EbookFoundation/free-programming-books","2013-10-11T06:50:37Z","2026-07-19T02:27:52Z"
"awesome-selfhosted/awesome-selfhosted",306542,"-","A list of Free Software network services and web applications which can be hosted on your own servers","https://github.com/awesome-selfhosted/awesome-selfhosted","2015-06-01T02:33:17Z","2026-07-19T02:03:36Z"
"obra/superpowers",257139,"Shell","An agentic skills framework & software development methodology that works.","https://github.com/obra/superpowers","2025-10-09T19:45:18Z","2026-07-19T02:27:51Z"
"affaan-m/ECC",230955,"JavaScript","The agent harness performance optimization system. Skills, instincts, memory, security, and research-first development for Claude Code, Codex, Opencode, Cursor and beyond.","https://github.com/affaan-m/ECC","2026-01-18T00:51:51Z","2026-07-19T02:25:27Z"
"TheAlgorithms/Python",222865,"Python","All Algorithms implemented in Python","https://github.com/TheAlgorithms/Python","2016-07-16T09:44:01Z","2026-07-19T01:51:30Z"
"NousResearch/hermes-agent",216872,"Python","The agent that grows with you","https://github.com/NousResearch/hermes-agent","2025-07-22T22:22:28Z","2026-07-19T02:27:42Z"
"n8n-io/n8n",196982,"TypeScript","Fair-code workflow automation platform with native AI capabilities. Combine visual building with custom code, self-host or cloud, 400+ integrations.","https://github.com/n8n-io/n8n","2019-06-22T09:24:21Z","2026-07-19T02:24:37Z"
"ultraworkers/claw-code",194813,"Rust","An agent-managed museum exhibit, built in Rust with Gajae-Code / LazyCodex — developed and maintained with no human intervention.","https://github.com/ultraworkers/claw-code","2026-03-31T08:58:08Z","2026-07-19T01:47:11Z"
"anomalyco/opencode",187248,"TypeScript","The open source coding agent.","https://github.com/anomalyco/opencode","2025-04-30T20:08:00Z","2026-07-19T02:20:52Z"
"DigitalPlatDev/FreeDomain",186680,"-","DigitalPlat FreeDomain: Free Domain For Everyone","https://github.com/DigitalPlatDev/FreeDomain","2024-05-30T13:23:00Z","2026-07-19T02:23:47Z"
"Significant-Gravitas/AutoGPT",185600,"Python","AutoGPT is the vision of accessible AI for everyone, to use and to build on. Our mission is to provide the tools, so that you can focus on what matters.","https://github.com/Significant-Gravitas/AutoGPT","2023-03-16T09:21:07Z","2026-07-19T02:07:40Z"
"yt-dlp/yt-dlp",178772,"Python","A feature-rich command-line audio/video downloader","https://github.com/yt-dlp/yt-dlp","2020-10-26T04:22:55Z","2026-07-19T02:14:43Z"
"anthropics/skills",162446,"Python","Public repository for Agent Skills","https://github.com/anthropics/skills","2025-09-22T15:53:31Z","2026-07-19T02:27:55Z"
"firecrawl/firecrawl",152827,"TypeScript","The API to search, scrape, and interact with the web at scale. 🔥","https://github.com/firecrawl/firecrawl","2024-04-15T21:02:29Z","2026-07-19T02:21:13Z"
"langgenius/dify",149267,"TypeScript","Production-ready platform for agentic workflow development.","https://github.com/langgenius/dify","2023-04-12T07:40:24Z","2026-07-19T02:23:01Z"
"open-webui/open-webui",145891,"Python","User-friendly AI Interface (Supports Ollama, OpenAI API, ...)","https://github.com/open-webui/open-webui","2023-10-06T22:08:27Z","2026-07-19T02:27:29Z"
"langchain-ai/langchain",142053,"Python","The agent engineering platform.","https://github.com/langchain-ai/langchain","2022-10-17T02:58:36Z","2026-07-19T02:00:42Z"
"anthropics/claude-code",138212,"Python","Claude Code is an agentic coding tool that lives in your terminal, understands your codebase, and helps you code faster by executing routine tasks, explaining complex code, and handling git workflows - all through natural language commands.","https://github.com/anthropics/claude-code","2025-02-22T17:41:21Z","2026-07-19T02:26:58Z"
"iptv-org/iptv",133268,"TypeScript","Collection of publicly available IPTV channels from all over the world","https://github.com/iptv-org/iptv","2018-11-14T22:00:57Z","2026-07-19T02:27:21Z"
"ripienaar/free-for-dev",129742,"HTML","A list of SaaS, PaaS and IaaS offerings that have free tiers of interest to devops and infradev","https://github.com/ripienaar/free-for-dev","2015-03-18T21:06:26Z","2026-07-19T02:21:48Z"
"Shubhamsaboo/awesome-llm-apps",124027,"Python","100+ AI Agent & RAG apps you can actually run — clone, customize, ship.","https://github.com/Shubhamsaboo/awesome-llm-apps","2024-04-29T05:30:25Z","2026-07-19T02:25:36Z"
"ggml-org/llama.cpp",120860,"C++","LLM inference in C/C++","https://github.com/ggml-org/llama.cpp","2023-03-10T18:58:00Z","2026-07-19T02:19:14Z"
"tauri-apps/tauri",109201,"Rust","Build smaller, faster, and more secure desktop and mobile applications with a web frontend.","https://github.com/tauri-apps/tauri","2019-07-13T09:09:37Z","2026-07-19T01:28:23Z"
"immich-app/immich",108089,"TypeScript","High performance self-hosted photo and video management solution.","https://github.com/immich-app/immich","2022-02-03T15:56:27Z","2026-07-19T01:06:24Z"
"nextlevelbuilder/ui-ux-pro-max-skill",107407,"Python","An AI SKILL that provide design intelligence for building professional UI/UX multiple platforms","https://github.com/nextlevelbuilder/ui-ux-pro-max-skill","2025-11-30T11:36:31Z","2026-07-19T02:27:16Z"
"supabase/supabase",106551,"TypeScript","The Postgres development platform. Supabase gives you a dedicated Postgres database to build your web, mobile, and AI applications.","https://github.com/supabase/supabase","2019-10-12T05:56:49Z","2026-07-19T02:16:38Z"
"VoltAgent/awesome-design-md",102958,"-","A collection of DESIGN.md files analysis by popular brand design systems. Drop one into your project and let coding agents generate a matching UI.","https://github.com/VoltAgent/awesome-design-md","2026-03-31T16:37:01Z","2026-07-19T02:24:09Z"
"mtdvio/every-programmer-should-know",100120,"-","A collection of (mostly) technical things every software developer should know about","https://github.com/mtdvio/every-programmer-should-know","2017-08-24T13:18:26Z","2026-07-19T02:19:49Z"
"microsoft/Web-Dev-For-Beginners",96035,"JavaScript","24 Lessons, 12 Weeks, Get Started as a Web Developer","https://github.com/microsoft/Web-Dev-For-Beginners","2020-11-10T02:44:00Z","2026-07-19T01:26:26Z"
"tailwindlabs/tailwindcss",95980,"TypeScript","A utility-first CSS framework for rapid UI development.","https://github.com/tailwindlabs/tailwindcss","2017-10-06T14:59:14Z","2026-07-18T22:57:40Z"
"oven-sh/bun",94855,"Rust","Incredibly fast JavaScript runtime, bundler, test runner, and package manager – all in one","https://github.com/oven-sh/bun","2021-04-14T00:48:17Z","2026-07-19T02:20:54Z"
"microsoft/playwright",93081,"TypeScript","Playwright is a framework for Web Testing and Automation. It allows testing Chromium, Firefox and WebKit with a single API. ","https://github.com/microsoft/playwright","2019-11-15T18:32:42Z","2026-07-19T01:23:53Z"
"Graphify-Labs/graphify",91000,"Python","AI coding assistant skill (Claude Code, Codex, OpenCode, Cursor, Gemini CLI, and more). Turn any folder of code, SQL schemas, R scripts, shell scripts, docs, papers, images, or videos into a queryable knowledge graph. App code + database schema + infrastructure in one graph.","https://github.com/Graphify-Labs/graphify","2026-04-03T15:49:07Z","2026-07-19T02:27:52Z"
"gohugoio/hugo",89025,"Go","The world’s fastest framework for building websites.","https://github.com/gohugoio/hugo","2013-07-04T15:26:26Z","2026-07-19T02:03:34Z"
"thedotmack/claude-mem",87760,"JavaScript","Persistent Context Across Sessions for Every Agent –  Captures everything your agent does during sessions, compresses it with AI, and injects relevant context back into future sessions. Works with Claude Code, OpenClaw, Codex, Gemini, Hermes, Copilot, OpenCode + More","https://github.com/thedotmack/claude-mem","2025-08-31T20:50:03Z","2026-07-19T02:20:08Z"
"zed-industries/zed",87201,"Rust","Code at the speed of thought – Zed is a high-performance, multiplayer code editor from the creators of Atom and Tree-sitter.","https://github.com/zed-industries/zed","2021-02-20T03:01:06Z","2026-07-19T02:27:51Z"
"PaddlePaddle/PaddleOCR",85763,"Python","Turn any PDF or image document into structured data for your AI. A powerful, lightweight OCR toolkit that bridges the gap between images/PDFs and LLMs. Supports 100+ languages.","https://github.com/PaddlePaddle/PaddleOCR","2020-05-08T10:38:16Z","2026-07-19T02:03:31Z"
"DietrichGebert/ponytail",85614,"JavaScript","Makes your AI agent think like the laziest senior dev in the room. The best code is the code you never wrote.","https://github.com/DietrichGebert/ponytail","2026-06-12T00:52:37Z","2026-07-19T02:27:45Z"
"junegunn/fzf",81833,"Go",":cherry_blossom: A command-line fuzzy finder","https://github.com/junegunn/fzf","2013-10-23T16:04:23Z","2026-07-19T01:56:40Z"
"ruvnet/RuView",81176,"Rust","π RuView turns commodity WiFi signals into real-time spatial intelligence, vital sign monitoring, and presence detection — all without a single pixel of video.","https://github.com/ruvnet/RuView","2025-06-07T04:32:30Z","2026-07-19T02:26:24Z"
"lobehub/lobehub",80489,"TypeScript","🤯 LobeHub is your Chief Agent Operator, organizing your agents into 7×24 operations by hiring, scheduling, and reporting on your entire AI team.","https://github.com/lobehub/lobehub","2023-05-21T07:19:12Z","2026-07-19T02:19:48Z"
"hoppscotch/hoppscotch",79825,"TypeScript","Open-Source API Development Ecosystem • https://hoppscotch.io • Offline, On-Prem & Cloud • Web, Desktop & CLI • Open-Source Alternative to Postman, Insomnia","https://github.com/hoppscotch/hoppscotch","2019-08-21T13:15:24Z","2026-07-19T01:17:28Z"
"netdata/netdata",79684,"Go","The fastest path to AI-powered full stack observability, even for lean teams.","https://github.com/netdata/netdata","2013-06-17T18:39:10Z","2026-07-19T01:15:30Z"
"nexu-io/open-design",79549,"TypeScript","🎨 The open-source Claude Design alternative. 🖥️ Local-first desktop app. 🖼️ Your coding agent becomes the design engine: prototypes, landing pages, dashboards, slides, images & video — real files, HTML/PDF/PPTX/MP4 export. 🤖 Claude Code / Codex / Cursor / Gemini / OpenCode / Qwen & 20+ CLIs via BYOK.","https://github.com/nexu-io/open-design","2026-04-28T04:25:20Z","2026-07-19T02:23:41Z"
"bytedance/deer-flow",77351,"Python","An open-source long-horizon SuperAgent harness that researches, codes, and creates. With the help of sandboxes, memories, tools, skill, subagents and message gateway, it handles different levels of tasks that could take minutes to hours.","https://github.com/bytedance/deer-flow","2025-05-07T02:50:19Z","2026-07-19T01:18:52Z"
"sdmg15/Best-websites-a-programmer-should-visit",76291,"-",":link: Some useful websites for programmers.","https://github.com/sdmg15/Best-websites-a-programmer-should-visit","2017-03-05T20:25:17Z","2026-07-19T02:15:45Z"
"OpenCut-app/OpenCut",75454,"TypeScript","The open-source CapCut alternative","https://github.com/OpenCut-app/OpenCut","2025-06-22T08:02:17Z","2026-07-19T02:26:33Z"
"openai/openai-cookbook",74747,"Jupyter Notebook","Examples and guides for using the OpenAI API","https://github.com/openai/openai-cookbook","2022-03-11T02:08:53Z","2026-07-19T00:08:12Z"
"hiyouga/LlamaFactory",73361,"Python","Unified Efficient Fine-Tuning of 100+ LLMs & VLMs (ACL 2024)","https://github.com/hiyouga/LlamaFactory","2023-05-28T10:09:12Z","2026-07-18T18:30:21Z"
"thedaviddias/Front-End-Checklist",73249,"MDX","🗂 The essential checklist for modern web development, for humans and AI agents","https://github.com/thedaviddias/Front-End-Checklist","2017-10-16T10:12:36Z","2026-07-19T01:26:27Z"
"earendil-works/pi",72435,"TypeScript","AI agent toolkit: unified LLM API, agent loop, TUI, coding agent CLI","https://github.com/earendil-works/pi","2025-08-09T14:03:50Z","2026-07-19T02:25:18Z"
"nektos/act",71114,"Go","Run your GitHub Actions locally 🚀","https://github.com/nektos/act","2019-01-02T19:53:43Z","2026-07-19T02:11:50Z"
"NationalSecurityAgency/ghidra",71056,"Java","Ghidra is a software reverse engineering (SRE) framework","https://github.com/NationalSecurityAgency/ghidra","2019-03-01T03:27:48Z","2026-07-19T02:23:01Z"
"OpenBB-finance/OpenBB",70739,"Python","Open Data Platform for analysts, quants and AI agents.","https://github.com/OpenBB-finance/OpenBB","2020-12-20T10:46:38Z","2026-07-19T02:07:08Z"
"toeverything/AFFiNE",70581,"TypeScript","There can be more than Notion and Miro. AFFiNE(pronounced [ə‘fain]) is a next-gen knowledge base that brings planning, sorting and creating all together. Privacy first, open-source, customizable and ready to use. ","https://github.com/toeverything/AFFiNE","2022-07-31T18:45:21Z","2026-07-19T01:07:23Z"
"ansible/ansible",69628,"Python","Ansible is a radically simple IT automation platform that makes your applications and systems easier to deploy and maintain. Automate everything from code deployment to network configuration to cloud management, in a language that approaches plain English, using SSH, with no agents to install on remote systems. https://docs.ansible.com.","https://github.com/ansible/ansible","2012-03-06T14:58:02Z","2026-07-18T23:06:15Z"
"leonardomso/33-js-concepts",66498,"JavaScript","📜 33 JavaScript concepts every developer should know.","https://github.com/leonardomso/33-js-concepts","2018-09-04T13:27:04Z","2026-07-18T23:06:51Z"
"code-yeongyu/oh-my-openagent",66119,"TypeScript","omo/lazycodex: The coding agent for tokenmaxxers;the one and only agent harness for complex codebases. For your Codex, for your OpenCode","https://github.com/code-yeongyu/oh-my-openagent","2025-12-03T01:40:05Z","2026-07-19T02:04:51Z"
"ruvnet/ruflo",65069,"TypeScript","🌊 The leading agent meta-harness. Deploy intelligent multi-player swarms, coordinate autonomous workflows, and build conversational AI systems. Features adaptive memory, self-learning intelligence, RAG integration, and native Claude Code / Codex / Hermes and many more Integrated","https://github.com/ruvnet/ruflo","2025-06-02T21:24:20Z","2026-07-19T01:58:14Z"
"alacritty/alacritty",64952,"Rust","A cross-platform, OpenGL terminal emulator.","https://github.com/alacritty/alacritty","2016-02-18T05:02:30Z","2026-07-19T00:23:30Z"
"nocodb/nocodb",64103,"TypeScript","🔥 🔥 🔥 A Free & Self-hostable Airtable Alternative","https://github.com/nocodb/nocodb","2017-10-29T18:51:48Z","2026-07-19T00:26:03Z"
"traefik/traefik",64036,"Go","The Cloud Native Application Proxy","https://github.com/traefik/traefik","2015-09-13T19:04:02Z","2026-07-19T02:01:34Z"
"warpdotdev/warp",63371,"Rust","Warp is an agentic development environment, born out of the terminal.","https://github.com/warpdotdev/warp","2021-07-08T18:48:08Z","2026-07-19T02:09:46Z"
"Fission-AI/OpenSpec",61506,"TypeScript","Spec-driven development (SDD) for AI coding assistants.","https://github.com/Fission-AI/OpenSpec","2025-08-05T10:37:45Z","2026-07-19T02:27:52Z"
"mem0ai/mem0",61136,"TypeScript","Universal memory layer for AI Agents","https://github.com/mem0ai/mem0","2023-06-20T08:58:36Z","2026-07-19T01:53:12Z"
"withastro/astro",61136,"TypeScript","The web framework for content-driven websites. ⭐️ Star to support our work!","https://github.com/withastro/astro","2021-03-15T17:19:47Z","2026-07-19T02:00:01Z"
"colbymchenry/codegraph",60804,"TypeScript","Pre-indexed code knowledge graph, auto syncs on code changes, for Claude Code, Codex, Gemini, Cursor, OpenCode, AntiGravity, Kiro, and Hermes Agent — fewer tokens, fewer tool calls, 100% local","https://github.com/colbymchenry/codegraph","2026-01-18T21:45:37Z","2026-07-19T02:24:51Z"
"pocketbase/pocketbase",59944,"Go","Open Source realtime backend in 1 file","https://github.com/pocketbase/pocketbase","2022-07-05T06:06:21Z","2026-07-19T02:06:38Z"
"headroomlabs-ai/headroom",59847,"Python","Compress tool outputs, logs, files, and RAG chunks before they reach the LLM. 20% fewer tokens for coding agents, 60-95% fewer tokens for JSON, same answers. Library, proxy, MCP server.","https://github.com/headroomlabs-ai/headroom","2026-01-07T19:58:51Z","2026-07-19T02:06:56Z"
"upstash/context7",59371,"TypeScript","Context7 Platform -- Up-to-date code documentation for LLMs and AI code editors","https://github.com/upstash/context7","2025-03-26T23:40:39Z","2026-07-19T01:53:50Z"
"coollabsio/coolify",58872,"PHP","An open-source, self-hostable PaaS alternative to Vercel, Heroku & Netlify that lets you easily deploy static sites, databases, full-stack applications and 280+ one-click services on your own servers.","https://github.com/coollabsio/coolify","2021-01-25T20:54:01Z","2026-07-19T02:19:23Z"
"Panniantong/Agent-Reach",57779,"Python","Give your AI agent eyes to see the entire internet. Read & search Twitter, Reddit, YouTube, GitHub, Bilibili, XiaoHongShu — one CLI, zero API fees.","https://github.com/Panniantong/Agent-Reach","2026-02-24T02:10:24Z","2026-07-19T02:27:57Z"
"FoundationAgents/OpenManus",57494,"Python","No fortress, purely open ground.  OpenManus is Coming.","https://github.com/FoundationAgents/OpenManus","2025-03-06T14:08:14Z","2026-07-19T01:49:44Z"
"MemPalace/mempalace",57458,"Python","The best-benchmarked open-source AI memory system. And it's free.","https://github.com/MemPalace/mempalace","2026-04-05T01:12:07Z","2026-07-19T01:30:51Z"
"zylon-ai/private-gpt",57340,"Python","Complete API layer for private AI applications on local models: RAG, skills, tools, MCP, text-to-sql, and more. Works with any OpenAI-compatible inference server.","https://github.com/zylon-ai/private-gpt","2023-05-02T09:15:31Z","2026-07-18T21:08:41Z"
"appwrite/appwrite",56606,"TypeScript","Appwrite® - complete cloud infrastructure for your web, mobile and AI apps. Including Auth, Databases, Storage, Functions, Messaging, Hosting, Realtime and more","https://github.com/appwrite/appwrite","2019-04-08T16:36:25Z","2026-07-19T02:01:58Z"
"karpathy/nanochat",56402,"Python","The best ChatGPT that $100 can buy.","https://github.com/karpathy/nanochat","2025-10-13T13:46:35Z","2026-07-19T01:02:21Z"
"crewAIInc/crewAI",55749,"Python","Framework for orchestrating role-playing, autonomous AI agents. By fostering collaborative intelligence, CrewAI empowers agents to work together seamlessly, tackling complex tasks.","https://github.com/crewAIInc/crewAI","2023-10-27T03:26:59Z","2026-07-19T02:11:53Z"
"Zie619/n8n-workflows",55741,"Python","all of the workflows of n8n i could find (also from the site itself)","https://github.com/Zie619/n8n-workflows","2025-05-14T08:43:59Z","2026-07-19T02:09:10Z"
"laurent22/joplin",55644,"TypeScript","Joplin - the privacy-focused note taking app with sync capabilities for Windows, macOS, Linux, Android and iOS.","https://github.com/laurent22/joplin","2017-01-16T21:49:41Z","2026-07-19T02:07:05Z"
"jellyfin/jellyfin",54417,"C#","The Free Software Media System - Server Backend & API","https://github.com/jellyfin/jellyfin","2018-12-09T06:36:45Z","2026-07-19T02:10:29Z"
"maybe-finance/maybe",54350,"Ruby","The personal finance app for everyone","https://github.com/maybe-finance/maybe","2024-01-01T22:23:46Z","2026-07-19T01:42:40Z"
"BerriAI/litellm",53970,"Python","The fastest, litest AI Gateway. Rust core with Python SDK. Call 100+ LLM APIs in OpenAI (or native) format with cost tracking, guardrails, load balancing, and logging [Bedrock, Azure, OpenAI, Anthropic, OpenAI, VertexAI, vLLM, Nvidia NIM]","https://github.com/BerriAI/litellm","2023-07-27T00:09:52Z","2026-07-19T02:25:32Z"
"twentyhq/twenty",53239,"TypeScript","The open alternative to Salesforce, designed for AI.","https://github.com/twentyhq/twenty","2022-12-01T13:04:40Z","2026-07-19T01:53:24Z"
"mvanhorn/last30days-skill",52661,"Python","AI agent skill that researches any topic across Reddit, X, YouTube, HN, Polymarket, and the web - then synthesizes a grounded summary","https://github.com/mvanhorn/last30days-skill","2026-01-23T20:37:37Z","2026-07-19T01:52:33Z"
"dockur/windows",52489,"Shell","Windows inside a Docker container.","https://github.com/dockur/windows","2024-01-14T13:09:40Z","2026-07-19T02:09:51Z"
"jesseduffield/lazydocker",52083,"Go","The lazier way to manage everything docker","https://github.com/jesseduffield/lazydocker","2019-05-18T08:53:50Z","2026-07-19T02:23:04Z"
"ggml-org/whisper.cpp",51848,"C++","Port of OpenAI's Whisper model in C/C++","https://github.com/ggml-org/whisper.cpp","2022-09-25T18:26:37Z","2026-07-19T02:23:14Z"
"aaif-goose/goose",51269,"Rust","an open source, extensible AI agent that goes beyond code suggestions - install, execute, edit, and test with any LLM","https://github.com/aaif-goose/goose","2024-08-23T19:03:36Z","2026-07-19T00:57:51Z"
"dbeaver/dbeaver",51052,"Java","Free universal database tool and SQL client","https://github.com/dbeaver/dbeaver","2015-10-21T08:26:28Z","2026-07-19T01:38:22Z"
"bmad-code-org/BMAD-METHOD",50781,"JavaScript","Breakthrough Method for Agile Ai Driven Development","https://github.com/bmad-code-org/BMAD-METHOD","2025-04-13T14:54:25Z","2026-07-19T02:04:55Z"
"hesreallyhim/awesome-claude-code",50345,"Python","A hand-picked collection of the finest of resources for the most awesome of agents, Claude Code, the undisputed champion of coding companions, from the unstoppable team at Anthropic PBC. A delectable showcase of top tier skills, ambidextrous agents, scintillating status lines, top notch developer tooling, and also we have plugins","https://github.com/hesreallyhim/awesome-claude-code","2025-04-19T20:55:59Z","2026-07-19T02:15:27Z"
"nlohmann/json",50168,"C++","JSON for Modern C++","https://github.com/nlohmann/json","2013-07-04T08:47:49Z","2026-07-19T00:16:20Z"
"microsoft/VibeVoice",50134,"Python","Open-Source Frontier Voice AI","https://github.com/microsoft/VibeVoice","2025-08-25T13:24:01Z","2026-07-19T00:27:36Z"
"huginn/huginn",49642,"Ruby","Create agents that monitor and act on your behalf.  Your agents are standing by!","https://github.com/huginn/huginn","2013-03-10T06:00:31Z","2026-07-19T02:09:39Z"
"hashicorp/terraform",49226,"Go","Terraform enables you to safely and predictably create, change, and improve infrastructure. It is a source-available tool that codifies APIs into declarative configuration files that can be shared amongst team members, treated as code, edited, reviewed, and versioned.","https://github.com/hashicorp/terraform","2014-03-13T22:25:48Z","2026-07-18T20:52:41Z"
"roboflow/supervision",48117,"Python","We write your reusable computer vision tools. 💜","https://github.com/roboflow/supervision","2022-11-28T14:08:44Z","2026-07-19T02:25:55Z"
"KRTirtho/spotube",47657,"Dart","🎧 Open source music streaming app! Available for both desktop & mobile!","https://github.com/KRTirtho/spotube","2021-02-14T03:17:58Z","2026-07-19T01:52:28Z"
"mudler/LocalAI",47654,"Go","LocalAI is the open-source AI engine. Run any model - LLMs, vision, voice, image, video - on any hardware. No GPU required.","https://github.com/mudler/LocalAI","2023-03-18T22:58:02Z","2026-07-19T01:44:54Z"
"Aider-AI/aider",47500,"Python","aider is AI pair programming in your terminal","https://github.com/Aider-AI/aider","2023-05-09T18:57:49Z","2026-07-19T02:05:02Z"
"ChromeDevTools/chrome-devtools-mcp",47155,"TypeScript","Chrome DevTools for coding agents","https://github.com/ChromeDevTools/chrome-devtools-mcp","2025-09-11T10:39:55Z","2026-07-19T02:19:01Z"
"KeygraphHQ/shannon",45844,"TypeScript","Shannon is an autonomous, white-box AI pentester for web applications and APIs. It analyzes your source code, identifies attack vectors, and executes real exploits to prove vulnerabilities before they reach production.","https://github.com/KeygraphHQ/shannon","2025-09-27T01:51:47Z","2026-07-19T02:10:38Z"
"9001/copyparty",45736,"Python","Portable file server with accelerated resumable uploads, dedup, WebDAV, SFTP, FTP, TFTP, zeroconf, media indexer, thumbnails++ all in one file","https://github.com/9001/copyparty","2019-05-26T15:28:33Z","2026-07-19T00:44:43Z"
"HKUDS/CLI-Anything",45555,"Python","""CLI-Anything: Making ALL Software Agent-Native"" -- CLI-Hub: https://clianything.cc/","https://github.com/HKUDS/CLI-Anything","2026-03-08T13:52:57Z","2026-07-19T02:26:27Z"
"milvus-io/milvus",45269,"Go","Milvus is a high-performance, cloud-native vector database built for scalable vector ANN search","https://github.com/milvus-io/milvus","2019-09-16T06:43:43Z","2026-07-18T22:13:05Z"
"files-community/Files",44350,"C#","A modern file manager that helps users organize their files and folders.","https://github.com/files-community/Files","2019-01-04T18:19:14Z","2026-07-19T02:26:16Z"
"sickn33/agentic-awesome-skills",43550,"Python","AAS Core preview is the local, agent-first control plane for discovering, recommending, validating, and planning exact skill stacks, backed by 1,965+ agentic skills. Includes CLI, local MCP, catalog, plugins, and Workbench.","https://github.com/sickn33/agentic-awesome-skills","2026-01-14T17:48:09Z","2026-07-19T01:54:25Z"
"paperless-ngx/paperless-ngx",43190,"Python","A community-supported supercharged document management system: scan, index and archive all your documents","https://github.com/paperless-ngx/paperless-ngx","2022-02-12T21:56:52Z","2026-07-19T00:51:02Z"
