full_name,stars,language,description,html_url,created_at,updated_at
"SamurAIGPT/llm-wiki-agent",3229,"Python","A personal knowledge base that builds and maintains itself. Drop in sources — Claude (or Codex/Gemini) reads them, extracts knowledge, and maintains a persistent interlinked wiki. Works with Claude Code, Codex, OpenCode, Gemini CLI. No API key needed.","https://github.com/SamurAIGPT/llm-wiki-agent","2023-04-21T08:31:00Z","2026-07-19T00:11:36Z"
"nicoverbruggen/phpmon",3217,"Swift","Easily install and configure your development environment with PHP. Serve sites with Laravel Valet, switch PHP versions, manage extensions, and quickly resolve issues automatically.","https://github.com/nicoverbruggen/phpmon","2019-06-13T07:22:41Z","2026-07-18T08:07:25Z"
"AutoMaker-Org/automaker",3204,"TypeScript","","https://github.com/AutoMaker-Org/automaker","2025-12-07T21:42:08Z","2026-07-18T15:19:47Z"
"docker/docker-agent",3200,"Go","AI Agent Builder and Runtime by Docker Engineering","https://github.com/docker/docker-agent","2025-09-01T12:14:45Z","2026-07-18T21:57:28Z"
"av/harbor",3143,"Python","Stop configuring your AI stack. Start using it. One command brings a complete pre-wired LLM stack with hundreds of services to explore.","https://github.com/av/harbor","2024-07-27T18:46:59Z","2026-07-17T20:19:21Z"
"mierak/rmpc",3108,"Rust","A modern, configurable, terminal based MPD Client with album art support via various terminal image protocols","https://github.com/mierak/rmpc","2024-03-12T17:59:34Z","2026-07-18T16:36:51Z"
"HeyWillow/willow",3074,"C","Open source, local, and self-hosted Amazon Echo/Google Home competitive Voice Assistant alternative","https://github.com/HeyWillow/willow","2023-03-31T14:05:15Z","2026-07-17T01:12:11Z"
"psmux/psmux",2976,"PowerShell","Tmux on Windows Powershell - tmux for PowerShell, Windows Terminal, cmd.exe. Includes psmux, pmux, and tmux commands. This is native High-Performance Tmux designed for Windows in Rust 🦀","https://github.com/psmux/psmux","2025-11-30T18:09:19Z","2026-07-19T01:36:05Z"
"nubjs/nub",2951,"Rust","The fast all-in-one Node.js toolkit","https://github.com/nubjs/nub","2026-06-03T18:36:21Z","2026-07-18T21:38:23Z"
"cosmicstack-labs/mercury-agent",2951,"TypeScript","Soul-driven AI agent with permission-hardened tools, token budgets, and multi-channel access. Runs 24/7 from CLI or Telegram.","https://github.com/cosmicstack-labs/mercury-agent","2026-04-20T12:46:31Z","2026-07-17T12:33:09Z"
"Veirt/weathr",2940,"Rust","a terminal weather app with ascii animation","https://github.com/Veirt/weathr","2026-02-08T17:52:29Z","2026-07-18T23:21:46Z"
"tranxuanthang/lrcget",2899,"Vue","Utility for mass-downloading LRC synced lyrics for your offline music library.","https://github.com/tranxuanthang/lrcget","2022-11-14T11:09:03Z","2026-07-19T00:53:30Z"
"bethington/ghidra-mcp",2858,"Java","Ghidra MCP Server — 200+ MCP tools for AI-powered reverse engineering. GUI plugin + headless server, lazy tool loading, convention enforcement, batch operations, Ghidra Server integration, and Docker deployment.","https://github.com/bethington/ghidra-mcp","2025-08-30T06:40:03Z","2026-07-19T01:32:38Z"
"RookieEnough/Orion-Store",2843,"TypeScript","The ultimate home for modded apps. OrionStore offers instant access to YouTube Morphe, YT Music Morphe, and essential open-source tools without the clutter. No servers, no tracking, just a beautiful, modern gateway to the apps you love.","https://github.com/RookieEnough/Orion-Store","2025-11-28T11:15:56Z","2026-07-18T20:14:27Z"
"agent-of-empires/agent-of-empires",2840,"Rust","Manage multiple Claude Code, OpenCode agents from either TUI or Web for easy access on mobile. Also supports Mistral Vibe, Codex CLI, Gemini CLI, Pi.dev, Copilot CLI, Factory Droid Coding.","https://github.com/agent-of-empires/agent-of-empires","2026-01-09T17:23:31Z","2026-07-18T20:37:27Z"
"tjackenpacken/taskbar-groups",2765,"C#","Lightweight utility for organizing the taskbar through groups","https://github.com/tjackenpacken/taskbar-groups","2020-12-16T14:14:04Z","2026-07-18T15:59:37Z"
"supermemoryai/claude-supermemory",2709,"JavaScript","Enable Claude Code to learn in real-time, update it's knowledge, and grow with you, using supermemory.","https://github.com/supermemoryai/claude-supermemory","2026-01-22T03:53:14Z","2026-07-18T23:12:56Z"
"bjarneo/cliamp",2706,"Go","cliamp - Terminal music player inspired by winamp ","https://github.com/bjarneo/cliamp","2026-02-24T07:18:59Z","2026-07-18T18:07:35Z"
"joshmedeski/sesh",2691,"Go","Smart tmux session manager","https://github.com/joshmedeski/sesh","2023-12-27T22:47:28Z","2026-07-18T23:38:55Z"
"ivan-lednev/obsidian-day-planner",2674,"TypeScript","An Obsidian plugin for day planning with a clean UI and a simple task format","https://github.com/ivan-lednev/obsidian-day-planner","2020-11-03T08:34:56Z","2026-07-17T15:18:59Z"
"Mesh-LLM/mesh-llm",2673,"Rust","Distributed AI/LLM for the people. Share compute privately or publicly to power your agents and chat.","https://github.com/Mesh-LLM/mesh-llm","2026-02-11T03:18:27Z","2026-07-19T02:14:52Z"
"gamosoft/NoteDiscovery",2663,"JavaScript","Your Self-Hosted Knowledge Base","https://github.com/gamosoft/NoteDiscovery","2025-11-05T12:54:29Z","2026-07-18T19:59:46Z"
"sytone/obsidian-remote",2602,"Dockerfile","Run Obsidian.md in a browser via a docker container.","https://github.com/sytone/obsidian-remote","2022-03-14T04:25:33Z","2026-07-17T10:04:14Z"
"GhostWriters/DockSTARTer",2566,"Shell","DockSTARTer helps you get started with running apps in Docker.","https://github.com/GhostWriters/DockSTARTer","2018-05-25T14:16:11Z","2026-07-17T14:07:01Z"
"itshover/itshover",2565,"TypeScript","Icons that move with intent","https://github.com/itshover/itshover","2025-12-29T06:34:14Z","2026-07-19T01:08:13Z"
"icereed/paperless-gpt",2546,"Go","Use LLMs and LLM Vision (OCR) to handle paperless-ngx - Document Digitalization powered by AI","https://github.com/icereed/paperless-gpt","2024-09-23T12:55:43Z","2026-07-18T23:48:28Z"
"alexbelgium/hassio-addons",2532,"Shell","My homeassistant addons","https://github.com/alexbelgium/hassio-addons","2020-12-12T11:09:48Z","2026-07-18T19:51:36Z"
"firecrawl/open-agent-builder",2527,"TypeScript","🔥 Visual workflow builder for AI agents powered by Firecrawl - drag-and-drop web scraping pipelines with real-time execution","https://github.com/firecrawl/open-agent-builder","2025-10-16T15:34:46Z","2026-07-18T19:33:29Z"
"onecli/onecli",2519,"TypeScript","Open-source credential gateway with a built-in vault. give your AI agents access to services without exposing keys.","https://github.com/onecli/onecli","2026-03-08T10:38:52Z","2026-07-19T01:34:32Z"
"sentriz/gonic",2474,"Go","music streaming server / free-software subsonic server API implementation","https://github.com/sentriz/gonic","2019-03-29T15:55:54Z","2026-07-18T23:19:35Z"
"semanser/codel",2459,"TypeScript","✨ Fully autonomous AI Agent that can perform complicated tasks and projects using terminal, browser, and editor.","https://github.com/semanser/codel","2024-03-18T17:21:32Z","2026-07-10T14:52:31Z"
"CoderLuii/HolyClaude",2445,"JavaScript","AI coding workstation: Claude Code + web UI + 8 AI CLIs + headless browser + 50+ tools","https://github.com/CoderLuii/HolyClaude","2026-03-22T01:03:18Z","2026-07-19T02:12:34Z"
"Helvesec/rmux",2430,"Rust","Universal Rust multiplexer with a typed SDK — drive any CLI or TUI app from code. Native on Linux, macOS, and Windows.","https://github.com/Helvesec/rmux","2026-05-15T15:22:10Z","2026-07-19T02:25:57Z"
"open-webui/pipelines",2419,"Python","Pipelines: Versatile, UI-Agnostic OpenAI-Compatible Plugin Framework ","https://github.com/open-webui/pipelines","2024-05-21T20:30:37Z","2026-07-18T14:19:18Z"
"compozy/compozy",2373,"Go","Drive the full lifecycle of AI-assisted development — from idea to shipped code.","https://github.com/compozy/compozy","2026-03-28T05:24:12Z","2026-07-18T23:27:53Z"
"legendsayantan/ShizuTools",2369,"Kotlin","Contains many tools to control android system via shizuku.","https://github.com/legendsayantan/ShizuTools","2023-10-23T22:00:40Z","2026-07-18T16:44:34Z"
"NeuralNomadsAI/CodeNomad",2368,"TypeScript","CodeNomad: The command center that puts AI coding on steroids.","https://github.com/NeuralNomadsAI/CodeNomad","2025-11-01T23:29:24Z","2026-07-18T16:27:12Z"
"Unmanic/unmanic",2352,"Python","Unmanic - Library Optimiser","https://github.com/Unmanic/unmanic","2019-01-05T19:40:36Z","2026-07-17T13:33:21Z"
"voidauth/voidauth",2342,"TypeScript","Single Sign-On for Your Self-Hosted Universe","https://github.com/voidauth/voidauth","2025-04-18T02:22:16Z","2026-07-18T20:54:29Z"
"spacedriveapp/spacebot",2335,"Rust","An AI agent for teams, communities, and multi-user environments.","https://github.com/spacedriveapp/spacebot","2026-02-11T23:53:16Z","2026-07-19T00:17:53Z"
"elevenlabs/ui",2315,"TypeScript","ElevenLabs UI is a component library and custom registry built on top of shadcn/ui to help you build multimodal agents faster.","https://github.com/elevenlabs/ui","2025-09-03T16:29:41Z","2026-07-17T19:48:26Z"
"koush/UniversalAdbDriver",2309,"C#","One size fits all Windows Drivers for Android Debug Bridge.","https://github.com/koush/UniversalAdbDriver","2013-04-07T22:20:54Z","2026-07-18T05:58:24Z"
"miraclx/freyr-js",2305,"JavaScript","A tool for downloading songs from music streaming services like Spotify and Apple Music.","https://github.com/miraclx/freyr-js","2020-02-25T08:16:17Z","2026-07-18T13:31:04Z"
"iamsrikanthnani/pluely",2304,"TypeScript","The Open Source Alternative to Cluely - A lightning-fast, privacy-first AI assistant that works seamlessly during meetings, interviews, and conversations without anyone knowing. Built with Tauri for native performance, just 10MB. Completely undetectable in video calls, screen shares, and recordings.","https://github.com/iamsrikanthnani/pluely","2025-08-16T11:57:54Z","2026-07-18T22:24:04Z"
"mistralai/cookbook",2291,"Jupyter Notebook","","https://github.com/mistralai/cookbook","2024-01-05T10:37:21Z","2026-07-18T13:37:40Z"
"kevinho/clawfeed",2290,"HTML","ClawFeed — AI-powered news digest with structured summaries from Twitter/RSS feeds and web dashboard","https://github.com/kevinho/clawfeed","2026-02-21T10:38:07Z","2026-07-19T01:33:28Z"
"RAIT-09/obsidian-agent-client",2286,"TypeScript","Bring AI agents into Obsidian via Agent Client Protocol (ACP), such as Claude Code, Codex and Gemini CLI.","https://github.com/RAIT-09/obsidian-agent-client","2025-09-18T09:47:13Z","2026-07-18T19:55:28Z"
"ChrispyBacon-dev/DockFlare",2283,"Python","DockFlare: Automate Cloudflare Tunnels with Docker Labels","https://github.com/ChrispyBacon-dev/DockFlare","2025-04-12T07:03:12Z","2026-07-18T23:00:05Z"
"NeptuneHub/AudioMuse-AI",2260,"Python","AudioMuse-AI uses sonic analysis to rediscover forgotten songs, uncover hidden connections in your music library, and generate intelligent playlists for Navidrome, Jellyfin, LMS, Lyrion, Emby and Plex: no metadata or external services required.","https://github.com/NeptuneHub/AudioMuse-AI","2025-05-24T08:12:12Z","2026-07-18T23:50:36Z"
"HKUDS/FastCode",2258,"Python","""FastCode: Accelerating and Streamlining Your Code Understanding""","https://github.com/HKUDS/FastCode","2026-02-13T06:43:54Z","2026-07-19T01:13:24Z"
"dweymouth/supersonic",2251,"Go","A lightweight and full-featured cross-platform desktop client for self-hosted music servers","https://github.com/dweymouth/supersonic","2022-12-18T00:47:54Z","2026-07-19T00:27:21Z"
"mostafa-wahied/portracker",2249,"JavaScript","An open source, self-hosted, real-time port monitoring and discovery tool.","https://github.com/mostafa-wahied/portracker","2025-07-07T10:32:54Z","2026-07-18T10:28:11Z"
"numman-ali/cc-mirror",2247,"TypeScript","Create multiple isolated Claude Code variants with custom providers (Z.ai, MiniMax, OpenRouter, LiteLLM)","https://github.com/numman-ali/cc-mirror","2026-01-02T22:28:50Z","2026-07-17T21:24:38Z"
"vava-nessa/free-coding-models",2173,"HTML","Find, benchmark and install in CLI 170+ FREE coding LLM models across 15+ providers in real time","https://github.com/vava-nessa/free-coding-models","2026-02-20T23:12:50Z","2026-07-18T19:44:49Z"
"dembrandt/dembrandt",2142,"TypeScript","Extract any website’s design system into tokens in seconds: logo, colors, typography, borders & more. One command.","https://github.com/dembrandt/dembrandt","2025-11-22T13:49:09Z","2026-07-18T22:30:04Z"
"sabamdarif/termux-desktop",2108,"Shell","Install a full Linux desktop environment on your Android device with Termux X11 ( VNC optional) and also enable hardware acceleration","https://github.com/sabamdarif/termux-desktop","2024-03-27T07:30:33Z","2026-07-19T01:54:30Z"
"mhss1/MyBrain",2104,"Kotlin","All-in-one productivity app and AI assistant with Tasks, Notes, Calendar, Diary and Bookmarks.","https://github.com/mhss1/MyBrain","2022-05-11T17:06:31Z","2026-07-18T20:36:58Z"
"stepfun-ai/Step-3.5-Flash",2090,"C++","Fast, Sharp & Reliable Agentic Intelligence","https://github.com/stepfun-ai/Step-3.5-Flash","2026-01-31T02:57:03Z","2026-07-13T04:22:22Z"
"alangrainger/immich-public-proxy",2086,"TypeScript","Share your Immich photos and albums in a safe way without exposing your Immich instance to the public.","https://github.com/alangrainger/immich-public-proxy","2024-10-29T14:59:27Z","2026-07-18T18:29:12Z"
"scambier/obsidian-omnisearch",2077,"TypeScript","A search engine that ""just works"" for Obsidian. Supports OCR and PDF indexing.","https://github.com/scambier/obsidian-omnisearch","2022-04-10T11:29:50Z","2026-07-19T01:11:30Z"
"fooyin/fooyin",2071,"C++","A customisable music player","https://github.com/fooyin/fooyin","2022-06-20T10:52:24Z","2026-07-19T00:10:09Z"
"ThioJoe/Windows-Super-God-Mode",2068,"PowerShell","Creates shortcuts to virtually every special location or action built into Windows","https://github.com/ThioJoe/Windows-Super-God-Mode","2024-08-14T17:51:35Z","2026-07-17T03:12:02Z"
"Nezreka/SoulSync",2063,"Python","Intelligent Music & Video Automation Platform","https://github.com/Nezreka/SoulSync","2025-07-09T19:07:58Z","2026-07-19T01:51:04Z"
"supreme-gg-gg/instagram-cli",2061,"TypeScript","Instagram's CLI and TUI client -- The ultimate weapon against brainrot","https://github.com/supreme-gg-gg/instagram-cli","2025-02-01T02:40:41Z","2026-07-19T00:38:26Z"
"jayfunc/BetterLyrics",2030,"C#","An elegant and deeply customizable lyrics visualizer & versatile music player, built with WinUI3/Win2D | 一款优雅且高度自定义的歌词可视化与全能音乐播放应用，基于 WinUI3/Win2D 构建","https://github.com/jayfunc/BetterLyrics","2025-05-13T02:53:02Z","2026-07-18T19:42:53Z"
"Notifuse/notifuse",2025,"Go","Notifuse is an open-source & modern emailing platform","https://github.com/Notifuse/notifuse","2025-03-15T12:39:25Z","2026-07-18T16:58:10Z"
"swingmx/swingmusic",2021,"Python"," Swing Music is a beautiful, self-hosted music player for your local audio files. Like a cooler Spotify ... but bring your own music.","https://github.com/swingmx/swingmusic","2021-11-14T09:05:18Z","2026-07-17T16:15:22Z"
"Gururagavendra/gmail-cleaner",2018,"Python","web based GUI to cleanup gmail delete, mark as read, unsubsribe from uncessary things u dont like","https://github.com/Gururagavendra/gmail-cleaner","2025-11-29T09:19:54Z","2026-07-18T19:12:56Z"
"platers/obsidian-linter",2005,"TypeScript","An Obsidian plugin that formats and styles your notes with a focus on configurability and extensibility.","https://github.com/platers/obsidian-linter","2021-08-02T23:30:28Z","2026-07-17T19:57:31Z"
"openclaw/openclaw-windows-node",1991,"C#","Windows companion suite for OpenClaw - System Tray app, Shared library, Node, and PowerToys Command Palette extension","https://github.com/openclaw/openclaw-windows-node","2026-01-29T01:34:54Z","2026-07-18T22:37:47Z"
"Make-md/makemd",1984,"TypeScript","","https://github.com/Make-md/makemd","2022-11-15T04:43:16Z","2026-07-18T03:32:46Z"
"saifyxpro/HeadlessX",1977,"TypeScript","The undetected self-hosted browser automation platform. Powered by Camoufox (Firefox) for 0% detection rates. Built for speed, privacy, and scalability.","https://github.com/saifyxpro/HeadlessX","2025-09-12T18:11:48Z","2026-07-17T06:49:44Z"
"dockpeek/dockpeek",1973,"JavaScript","Easily access your Docker container web interfaces and keep them up to date — across all your hosts.","https://github.com/dockpeek/dockpeek","2025-06-14T21:26:09Z","2026-07-17T14:35:26Z"
"lupantech/AgentFlow",1964,"Python","AgentFlow: In-the-Flow Agentic System Optimization","https://github.com/lupantech/AgentFlow","2025-09-27T02:17:05Z","2026-07-17T11:35:28Z"
"forloopcodes/contextplus",1959,"TypeScript","Semantic Intelligence for Large-Scale Engineering. Context+ is an MCP server designed for developers who demand 99% accuracy. By combining RAG, Tree-sitter AST, Spectral Clustering, and Obsidian-style linking, Context+ turns a massive codebase into a searchable, hierarchical feature graph.","https://github.com/forloopcodes/contextplus","2026-02-27T12:12:20Z","2026-07-17T23:37:56Z"
"kenn-io/msgvault",1935,"Go","Archive a lifetime of email and chat. Offline search, analytics, and AI query over your full message history. Powered by SQLite and DuckDB","https://github.com/kenn-io/msgvault","2026-01-28T10:49:55Z","2026-07-19T02:11:44Z"
"Romanitho/Winget-AutoUpdate",1932,"PowerShell","WAU daily updates apps as system and notify connected users. (Allowlist and Blocklist support)","https://github.com/Romanitho/Winget-AutoUpdate","2022-01-16T17:01:18Z","2026-07-18T04:50:47Z"
"astrofox-io/astrofox",1931,"TypeScript","Astrofox is a motion graphics program that lets you turn audio into amazing videos.","https://github.com/astrofox-io/astrofox","2018-07-13T04:55:18Z","2026-07-17T23:56:41Z"
"Infisical/agent-vault",1909,"Go","A HTTP credential proxy and vault for AI agents like Claude Code, OpenClaw, Hermes, custom agents + harnesses, and more.","https://github.com/Infisical/agent-vault","2026-03-27T21:47:17Z","2026-07-18T23:30:49Z"
"Runnin4ik/dpi-detector",1901,"Python","DPI detection tool for internet censorship testing. Identifies TLS, TCP, HTTP, DNS blocking and 16-20KB connection drops","https://github.com/Runnin4ik/dpi-detector","2026-02-13T22:00:15Z","2026-07-18T21:43:29Z"
"mudler/LocalAGI",1881,"Go","LocalAGI is a powerful, self-hostable AI Agent platform designed for maximum privacy and flexibility. A complete drop-in replacement for OpenAI's Responses APIs with advanced agentic capabilities. No clouds.  Local AI that works on consumer-grade hardware (CPU and GPU).","https://github.com/mudler/LocalAGI","2023-07-27T23:21:36Z","2026-07-18T18:23:57Z"
"aelassas/servy",1877,"C#","Professional-Grade Windows Service Wrapper with Real-Time Monitoring","https://github.com/aelassas/servy","2025-08-02T15:09:07Z","2026-07-19T00:04:21Z"
"massivemadness/Squircle-CE",1852,"Kotlin","👨‍💻 Squircle CE is a fast and free multi-language code editor for Android","https://github.com/massivemadness/Squircle-CE","2017-08-17T10:07:48Z","2026-07-17T16:41:07Z"
"Th0rgal/open-ralph-wiggum",1847,"TypeScript","Type `ralph ""prompt""` to start open code in a ralph loop. Also supports a prompt file & status check. Open Code, Claude Code, Codex, Copilot","https://github.com/Th0rgal/open-ralph-wiggum","2026-01-06T08:06:47Z","2026-07-18T20:58:08Z"
"tranxuanthang/lrclib",1836,"Rust","LRCLIB server written in Rust with Axum and SQLite3 database","https://github.com/tranxuanthang/lrclib","2024-04-30T14:56:26Z","2026-07-19T00:51:30Z"
"rustmailer/bichon",1825,"TypeScript","Bichon – A lightweight, high-performance Rust email archiver with WebUI","https://github.com/rustmailer/bichon","2025-11-18T18:02:57Z","2026-07-19T02:08:22Z"
"geekau/mediastack",1800,"Shell","The ultimate Docker Compose files and configs to build your desired media stack, quickly and easily, with secure outbound network traffic and secure remote access using multifactor authentication.","https://github.com/geekau/mediastack","2022-11-03T07:34:08Z","2026-07-17T23:14:58Z"
"LumePart/Explo",1766,"Go","Spotify's ""Discover Weekly"" for self-hosted music systems","https://github.com/LumePart/Explo","2023-11-10T10:24:46Z","2026-07-18T13:22:42Z"
"clemcer/LoggiFly",1760,"Python","Get Alerts from your Docker Container Logs","https://github.com/clemcer/LoggiFly","2025-01-13T18:20:33Z","2026-07-16T07:37:11Z"
"SpatiumPortae/portal",1758,"Go","Portal is a quick and easy command-line file transfer utility from any computer to another 🌌 ✨","https://github.com/SpatiumPortae/portal","2021-10-01T11:44:20Z","2026-07-15T15:05:42Z"
"Jellify-Music/App",1745,"TypeScript","A cross-platform, free and open source music player for Jellyfin, powered by React Native","https://github.com/Jellify-Music/App","2024-08-09T21:22:59Z","2026-07-18T13:23:37Z"
"ShinMegamiBoson/OpenPlanter",1703,"Python","","https://github.com/ShinMegamiBoson/OpenPlanter","2026-02-20T01:04:23Z","2026-07-19T02:24:30Z"
"anubhavsrivastava/awesome-ui-component-library",1703,"JavaScript","Curated list of framework component libraries for UI styles/toolkit","https://github.com/anubhavsrivastava/awesome-ui-component-library","2018-11-25T07:32:19Z","2026-07-13T19:56:35Z"
"iam4x/bobarr",1694,"TypeScript","🍿 The all-in-one alternative for Sonarr, Radarr, Jackett... with a VPN and running in docker","https://github.com/iam4x/bobarr","2020-04-05T21:29:24Z","2026-07-12T17:24:31Z"
"aculix/bitplay",1681,"CSS","Stream video torrents in your web browser with ease.","https://github.com/aculix/bitplay","2025-04-18T19:29:00Z","2026-07-17T13:44:23Z"
"theotherp/nzbhydra2",1671,"JavaScript","Usenet meta search","https://github.com/theotherp/nzbhydra2","2017-09-15T05:08:08Z","2026-07-18T03:14:30Z"
"the-open-engine/zeroshot",1652,"JavaScript","Your autonomous engineering team in a CLI. The agent loop produces senior-level code that you can actually trust in prod because of non-negotiable feedback from independent reviewers. Supports Claude Code, OpenAI Codex, OpenCode, and Gemini CLI with trivial setup.","https://github.com/the-open-engine/zeroshot","2025-12-25T17:12:45Z","2026-07-18T23:11:58Z"
"BLeeEZ/amperfy",1646,"Swift","Amperfy is an iOS/iPadOS/macOS app to play songs from an Ampache or Subsonic server","https://github.com/BLeeEZ/amperfy","2019-03-09T18:48:46Z","2026-07-19T01:11:01Z"
"GoogleCloudPlatform/scion",1632,"Go","","https://github.com/GoogleCloudPlatform/scion","2026-03-10T00:19:58Z","2026-07-19T00:58:47Z"
"kenforthewin/atomic",1607,"Rust","Self-hosted, semantically-connected personal knowledge base","https://github.com/kenforthewin/atomic","2025-11-25T14:18:06Z","2026-07-18T12:27:55Z"
"Simpleyyt/ai-manus",1593,"Python","AI Manus is a general-purpose AI Agent system that supports running various tools and operations in a sandbox environment.","https://github.com/Simpleyyt/ai-manus","2025-04-26T18:08:34Z","2026-07-18T10:59:09Z"
"GoogleChrome/modern-web-guidance",1568,"-","","https://github.com/GoogleChrome/modern-web-guidance","2026-03-23T17:49:14Z","2026-07-18T18:52:17Z"
"Sync-in/server",1564,"TypeScript","Sync-in Server · Sovereign platform for file storage, sharing, synchronization, and collaboration.","https://github.com/Sync-in/server","2025-07-13T16:25:43Z","2026-07-19T02:17:56Z"
"Yakitrak/notesmd-cli",1553,"Go","Obsidian CLI (Community) -  Interact with Obsidian in the terminal!","https://github.com/Yakitrak/notesmd-cli","2023-01-14T14:31:00Z","2026-07-17T13:11:39Z"
"vercel-labs/dev3000",1552,"TypeScript","Captures your web app's complete development timeline - server logs, browser events, console messages, network requests, and automatic screenshots - in a unified, timestamped feed for AI debugging.","https://github.com/vercel-labs/dev3000","2025-09-02T23:36:10Z","2026-07-18T05:41:54Z"
"xxnuo/open-coreui",1533,"Svelte","Open CoreUI - A rewritten Open WebUI in Rust, significantly reducing memory and resource usage, requiring no dependency services, no Docker, with both a server version and a Tauri-based desktop client. (formerly Open WebUI Lite)","https://github.com/xxnuo/open-coreui","2025-04-14T03:32:45Z","2026-07-12T22:49:59Z"
"Prat011/free-cluely",1525,"TypeScript","Cluely - The invisible desktop assistant that provides real-time insights, answers, and support during meetings, interviews, presentations, and professional conversations.","https://github.com/Prat011/free-cluely","2025-05-04T03:26:21Z","2026-07-19T00:52:21Z"
"OminousIndustries/PhoneDriver",1518,"Python","Android Phone Control With Qwen3-VL","https://github.com/OminousIndustries/PhoneDriver","2025-10-14T20:00:48Z","2026-07-19T01:15:26Z"
"K-Dense-AI/karpathy",1510,"Python","An agentic Machine Learning Engineer","https://github.com/K-Dense-AI/karpathy","2025-11-16T22:39:26Z","2026-07-17T16:52:58Z"
"modelscope/AgentEvolver",1498,"Python","AgentEvolver: Towards Efficient Self-Evolving Agent System","https://github.com/modelscope/AgentEvolver","2025-11-13T08:09:51Z","2026-07-19T00:21:20Z"
"hashicorp/terraform-mcp-server",1474,"Go","The Terraform MCP Server provides seamless integration with Terraform ecosystem, enabling advanced automation and interaction capabilities for Infrastructure as Code (IaC) development.","https://github.com/hashicorp/terraform-mcp-server","2025-04-19T19:49:09Z","2026-07-18T16:27:56Z"
"sassanix/Warracker",1462,"JavaScript","🛡️ Warracker is an open source, self-hostable warranty tracker to monitor expirations, store receipts, files. You own the data, your rules!","https://github.com/sassanix/Warracker","2025-03-02T02:40:52Z","2026-07-16T13:33:54Z"
"kenryu42/cc-safety-net",1449,"TypeScript","A coding agent CLI hook that acts as a safety net, catching destructive git and filesystem commands before they execute. Supports Codex, Claude Code, OpenCode, Gemini CLI, Copilot CLI, Kimi Code and Pi.","https://github.com/kenryu42/cc-safety-net","2025-12-25T17:52:57Z","2026-07-18T09:05:36Z"
